[
  { "country_id": "thailand", "reviewed_fields": ["visa_entry", "digital_nomad_visa"], "last_reviewed_at": "2026-07-17T00:00:00Z", "sources": [{ "field": "visa_entry", "name": "泰国移民局", "url": "https://www.immigration.go.th/", "source_type": "official" }, { "field": "digital_nomad_visa", "name": "Thai e-Visa", "url": "https://www.thaievisa.go.th/", "source_type": "official" }], "review_note": "仅复核签证入口；费用、网速和生活成本仍为参考指标。" },
  { "country_id": "malaysia", "reviewed_fields": ["visa_entry"], "last_reviewed_at": "2026-07-17T00:00:00Z", "sources": [{ "field": "visa_entry", "name": "马来西亚移民局", "url": "https://www.imi.gov.my/", "source_type": "official" }], "review_note": "仅复核签证入口；其他指标未作官方背书。" },
  { "country_id": "singapore", "reviewed_fields": ["visa_entry"], "last_reviewed_at": "2026-07-17T00:00:00Z", "sources": [{ "field": "visa_entry", "name": "新加坡移民与关卡局", "url": "https://www.ica.gov.sg/", "source_type": "official" }], "review_note": "仅复核签证入口；其他指标未作官方背书。" },
  { "country_id": "japan", "reviewed_fields": ["visa_entry"], "last_reviewed_at": "2026-07-17T00:00:00Z", "sources": [{ "field": "visa_entry", "name": "日本驻华大使馆", "url": "https://www.cn.emb-japan.go.jp/itpr_zh/visa.html", "source_type": "official" }], "review_note": "仅复核签证入口；其他指标未作官方背书。" },
  { "country_id": "vietnam", "reviewed_fields": ["visa_entry"], "last_reviewed_at": "2026-07-17T00:00:00Z", "sources": [{ "field": "visa_entry", "name": "越南电子签证门户", "url": "https://evisa.xuatnhapcanh.gov.vn/", "source_type": "official" }], "review_note": "仅复核签证入口；其他指标未作官方背书。" },
  { "country_id": "uae", "reviewed_fields": ["visa_entry"], "last_reviewed_at": "2026-07-17T00:00:00Z", "sources": [{ "field": "visa_entry", "name": "阿联酋身份、公民、海关与港口安全局", "url": "https://icp.gov.ae/", "source_type": "official" }], "review_note": "仅复核签证入口；其他指标未作官方背书。" },
  { "country_id": "portugal", "reviewed_fields": ["visa_entry"], "last_reviewed_at": "2026-07-17T00:00:00Z", "sources": [{ "field": "visa_entry", "name": "葡萄牙融合、移民与庇护局", "url": "https://aima.gov.pt/pt", "source_type": "official" }], "review_note": "仅复核签证入口；其他指标未作官方背书。" },
  { "country_id": "spain", "reviewed_fields": ["visa_entry"], "last_reviewed_at": "2026-07-17T00:00:00Z", "sources": [{ "field": "visa_entry", "name": "西班牙包容、社会保障与移民部", "url": "https://www.inclusion.gob.es/", "source_type": "official" }], "review_note": "仅复核签证入口；其他指标未作官方背书。" },
  { "country_id": "estonia", "reviewed_fields": ["visa_entry"], "last_reviewed_at": "2026-07-17T00:00:00Z", "sources": [{ "field": "visa_entry", "name": "爱沙尼亚警察与边防局", "url": "https://www.politsei.ee/en/", "source_type": "official" }], "review_note": "仅复核签证入口；其他指标未作官方背书。" },
  { "country_id": "uk", "reviewed_fields": ["visa_entry"], "last_reviewed_at": "2026-07-17T00:00:00Z", "sources": [{ "field": "visa_entry", "name": "英国政府签证服务", "url": "https://www.gov.uk/standard-visitor-visa", "source_type": "official" }], "review_note": "仅复核签证入口；其他指标未作官方背书。" }
]
